character,character_normalized,dialogue,context,character_state,dialogue_type,motivation,line_number,scene,movie,word_count,sentiment
LUKE,Luke Skywalker,You’ll get it!,"Exterior: TATOOINE – ANCHORHEAD SETTLEMENT – POWER | Jedi training, heroic journey",Urgent/Commanding,Exclamation,Assertive,1893,EXT. TATOOINE – ANCHORHEAD SETTLEMENT – POWER,Star Wars A New Hope,3,neutral
HAN,Han Solo,I better!,"Exterior: TATOOINE – ANCHORHEAD SETTLEMENT – POWER | Smuggler confidence, roguish charm",Urgent/Commanding,Exclamation,Assertive,1894,EXT. TATOOINE – ANCHORHEAD SETTLEMENT – POWER,Star Wars A New Hope,2,neutral
LUKE,Luke Skywalker,You will…,"Exterior: TATOOINE – ANCHORHEAD SETTLEMENT – POWER | Jedi training, heroic journey",Neutral,Statement,Conversational,1895,EXT. TATOOINE – ANCHORHEAD SETTLEMENT – POWER,Star Wars A New Hope,2,neutral
HAN,Han Solo,"All right, kid. But you’d better be right about this!","Exterior: TATOOINE – ANCHORHEAD SETTLEMENT – POWER | Smuggler confidence, roguish charm",Urgent/Commanding,Exclamation,Assertive,1896,EXT. TATOOINE – ANCHORHEAD SETTLEMENT – POWER,Star Wars A New Hope,10,neutral
LUKE,Luke Skywalker,All right.,"Exterior: TATOOINE – ANCHORHEAD SETTLEMENT – POWER | Jedi training, heroic journey",Positive/Agreeable,Statement,Supportive,1898,EXT. TATOOINE – ANCHORHEAD SETTLEMENT – POWER,Star Wars A New Hope,2,positive
HAN,Han Solo,What’s your plan?,"Exterior: TATOOINE – ANCHORHEAD SETTLEMENT – POWER | Smuggler confidence, roguish charm",Inquisitive,Question,Seeking information,1899,EXT. TATOOINE – ANCHORHEAD SETTLEMENT – POWER,Star Wars A New Hope,3,neutral
LUKE,Luke Skywalker,"Uh… Threepio, hand me those binders there will you?","Exterior: TATOOINE – ANCHORHEAD SETTLEMENT – POWER | Jedi training, heroic journey",Inquisitive,Question,Seeking information,1900,EXT. TATOOINE – ANCHORHEAD SETTLEMENT – POWER,Star Wars A New Hope,9,neutral
LUKE,Luke Skywalker,"Okay. Now, I’m going to put these on you.","Exterior: TATOOINE – ANCHORHEAD SETTLEMENT – POWER | Jedi training, heroic journey",Resistant/Negative,Statement,Opposing,1902,EXT. TATOOINE – ANCHORHEAD SETTLEMENT – POWER,Star Wars A New Hope,9,negative
LUKE,Luke Skywalker,"Okay. Han, you put these on.","Exterior: TATOOINE – ANCHORHEAD SETTLEMENT – POWER | Jedi training, heroic journey",Neutral,Statement,Conversational,1904,EXT. TATOOINE – ANCHORHEAD SETTLEMENT – POWER,Star Wars A New Hope,6,neutral
HAN,Han Solo,"Don’t worry, Chewie. I think I know what he has in mind.","Exterior: TATOOINE – ANCHORHEAD SETTLEMENT – POWER | Smuggler confidence, roguish charm",Resistant/Negative,Statement,Opposing,1906,EXT. TATOOINE – ANCHORHEAD SETTLEMENT – POWER,Star Wars A New Hope,12,negative
THREEPIO,C-3PO,"Master Luke, sir! Pardon me for asking… but, ah… what","Exterior: TATOOINE – ANCHORHEAD SETTLEMENT – POWER | Protocol droid formality, worry",Urgent/Commanding,Exclamation,Assertive,1909,EXT. TATOOINE – ANCHORHEAD SETTLEMENT – POWER,Star Wars A New Hope,10,neutral
LUKE,Luke Skywalker,Lock the door!,"Exterior: TATOOINE – ANCHORHEAD SETTLEMENT – POWER | Jedi training, heroic journey",Urgent/Commanding,Exclamation,Assertive,1911,EXT. TATOOINE – ANCHORHEAD SETTLEMENT – POWER,Star Wars A New Hope,3,neutral
HAN,Han Solo,And hope they don’t have blasters.,"Exterior: TATOOINE – ANCHORHEAD SETTLEMENT – POWER | Smuggler confidence, roguish charm",Neutral,Statement,Conversational,1912,EXT. TATOOINE – ANCHORHEAD SETTLEMENT – POWER,Star Wars A New Hope,6,neutral
THREEPIO,C-3PO,That isn’t very reassuring.,"Exterior: TATOOINE – ANCHORHEAD SETTLEMENT – POWER | Protocol droid formality, worry",Neutral,Statement,Conversational,1913,EXT. TATOOINE – ANCHORHEAD SETTLEMENT – POWER,Star Wars A New Hope,4,neutral
AREA,Area,– ELEVATOR TUBE,Exterior: TATOOINE – ANCHORHEAD SETTLEMENT – POWER,Urgent/Commanding,Exclamation,Assertive,1916,EXT. TATOOINE – ANCHORHEAD SETTLEMENT – POWER,Star Wars A New Hope,3,neutral
LUKE,Luke Skywalker,I can’t see a thing in this helmet.,"Exterior: TATOOINE – ANCHORHEAD SETTLEMENT – POWER | Jedi training, heroic journey",Neutral,Statement,Conversational,1922,EXT. TATOOINE – ANCHORHEAD SETTLEMENT – POWER,Star Wars A New Hope,8,neutral
STAR,Star,– INT. ELEVATOR – DETENTION SECURITY AREA,Exterior: TATOOINE – ANCHORHEAD SETTLEMENT – POWER,Urgent/Commanding,Exclamation,Assertive,1933,EXT. TATOOINE – ANCHORHEAD SETTLEMENT – POWER,Star Wars A New Hope,7,neutral
HAN,Han Solo,This is not going to work.,"Exterior: TATOOINE – ANCHORHEAD SETTLEMENT – POWER | Smuggler confidence, roguish charm",Resistant/Negative,Statement,Opposing,1938,EXT. TATOOINE – ANCHORHEAD SETTLEMENT – POWER,Star Wars A New Hope,6,negative
LUKE,Luke Skywalker,Why didn’t you say so before?,"Exterior: TATOOINE – ANCHORHEAD SETTLEMENT – POWER | Jedi training, heroic journey",Inquisitive,Question,Seeking information,1939,EXT. TATOOINE – ANCHORHEAD SETTLEMENT – POWER,Star Wars A New Hope,6,neutral
HAN,Han Solo,I did say so before! INT. DETENTION AREA,"Exterior: TATOOINE – ANCHORHEAD SETTLEMENT – POWER | Smuggler confidence, roguish charm",Urgent/Commanding,Exclamation,Assertive,1940,EXT. TATOOINE – ANCHORHEAD SETTLEMENT – POWER,Star Wars A New Hope,8,neutral
OFFICER,Officer,Where are you taking this… thing?,Exterior: TATOOINE – ANCHORHEAD SETTLEMENT – POWER,Inquisitive,Question,Seeking information,1942,EXT. TATOOINE – ANCHORHEAD SETTLEMENT – POWER,Star Wars A New Hope,6,neutral
LUKE,Luke Skywalker,Prisoner transfer from Block one- one-three-eight.,"Exterior: TATOOINE – ANCHORHEAD SETTLEMENT – POWER | Jedi training, heroic journey",Neutral,Statement,Conversational,1944,EXT. TATOOINE – ANCHORHEAD SETTLEMENT – POWER,Star Wars A New Hope,6,neutral
OFFICER,Officer,I wasn’t notified. I’ll have to clear it.,Exterior: TATOOINE – ANCHORHEAD SETTLEMENT – POWER,Resistant/Negative,Statement,Opposing,1945,EXT. TATOOINE – ANCHORHEAD SETTLEMENT – POWER,Star Wars A New Hope,8,negative
HAN,Han Solo,Look out! He’s loose!,"Exterior: TATOOINE – ANCHORHEAD SETTLEMENT – POWER | Smuggler confidence, roguish charm",Urgent/Commanding,Exclamation,Assertive,1953,EXT. TATOOINE – ANCHORHEAD SETTLEMENT – POWER,Star Wars A New Hope,4,neutral
LUKE,Luke Skywalker,He’s going to pull us all apart.,"Exterior: TATOOINE – ANCHORHEAD SETTLEMENT – POWER | Jedi training, heroic journey",Neutral,Statement,Conversational,1954,EXT. TATOOINE – ANCHORHEAD SETTLEMENT – POWER,Star Wars A New Hope,7,neutral
HAN,Han Solo,Go get him!,"Exterior: TATOOINE – ANCHORHEAD SETTLEMENT – POWER | Smuggler confidence, roguish charm",Urgent/Commanding,Exclamation,Assertive,1955,EXT. TATOOINE – ANCHORHEAD SETTLEMENT – POWER,Star Wars A New Hope,3,neutral
HAN,Han Solo,We’ve got to find out which cell this princess of yours is in. Here,"Exterior: TATOOINE – ANCHORHEAD SETTLEMENT – POWER | Smuggler confidence, roguish charm",Neutral,Statement,Conversational,1964,EXT. TATOOINE – ANCHORHEAD SETTLEMENT – POWER,Star Wars A New Hope,14,neutral
HAN,Han Solo,(sounding official) Everything is under control. Situation normal.,"Exterior: TATOOINE – ANCHORHEAD SETTLEMENT – POWER | Smuggler confidence, roguish charm",Resistant/Negative,Statement,Opposing,1969,EXT. TATOOINE – ANCHORHEAD SETTLEMENT – POWER,Star Wars A New Hope,8,negative
INTERCOM,Intercom,VOICE What happened?,Exterior: TATOOINE – ANCHORHEAD SETTLEMENT – POWER,Inquisitive,Question,Seeking information,1970,EXT. TATOOINE – ANCHORHEAD SETTLEMENT – POWER,Star Wars A New Hope,3,neutral
HAN,Han Solo,"(getting nervous) Uh… had a slight weapons malfunction. But,","Exterior: TATOOINE – ANCHORHEAD SETTLEMENT – POWER | Smuggler confidence, roguish charm",Neutral,Statement,Conversational,1971,EXT. TATOOINE – ANCHORHEAD SETTLEMENT – POWER,Star Wars A New Hope,9,neutral
INTERCOM,Intercom,VOICE We’re sending a squad up.,Exterior: TATOOINE – ANCHORHEAD SETTLEMENT – POWER,Neutral,Statement,Conversational,1974,EXT. TATOOINE – ANCHORHEAD SETTLEMENT – POWER,Star Wars A New Hope,6,neutral
HAN,Han Solo,"Uh, uh, negative, negative. We had a reactor leak here now.","Exterior: TATOOINE – ANCHORHEAD SETTLEMENT – POWER | Smuggler confidence, roguish charm",Resistant/Negative,Statement,Opposing,1975,EXT. TATOOINE – ANCHORHEAD SETTLEMENT – POWER,Star Wars A New Hope,11,negative
INTERCOM,Intercom,VOICE Who is this? What’s your operating number?,Exterior: TATOOINE – ANCHORHEAD SETTLEMENT – POWER,Inquisitive,Question,Seeking information,1977,EXT. TATOOINE – ANCHORHEAD SETTLEMENT – POWER,Star Wars A New Hope,8,neutral
HAN,Han Solo,Boring conversation anyway. (yelling down the hall) Luke! We’re,"Exterior: TATOOINE – ANCHORHEAD SETTLEMENT – POWER | Smuggler confidence, roguish charm",Urgent/Commanding,Exclamation,Assertive,1979,EXT. TATOOINE – ANCHORHEAD SETTLEMENT – POWER,Star Wars A New Hope,9,neutral
LEIA,Princess Leia,(finally) Aren’t you a little short for a stormtrooper?,"Exterior: TATOOINE – ANCHORHEAD SETTLEMENT – POWER | Rebel leadership, royal dignity",Inquisitive,Question,Seeking information,1987,EXT. TATOOINE – ANCHORHEAD SETTLEMENT – POWER,Star Wars A New Hope,9,neutral
LUKE,Luke Skywalker,What? Oh… the uniform. I’m Luke Skywalker. I’m here,"Exterior: TATOOINE – ANCHORHEAD SETTLEMENT – POWER | Jedi training, heroic journey",Inquisitive,Question,Seeking information,1989,EXT. TATOOINE – ANCHORHEAD SETTLEMENT – POWER,Star Wars A New Hope,9,neutral
LEIA,Princess Leia,You’re who?,"Exterior: TATOOINE – ANCHORHEAD SETTLEMENT – POWER | Rebel leadership, royal dignity",Inquisitive,Question,Seeking information,1991,EXT. TATOOINE – ANCHORHEAD SETTLEMENT – POWER,Star Wars A New Hope,2,neutral
LUKE,Luke Skywalker,I’m here to rescue you. I’ve got your R2 unit. I’m here with,"Exterior: TATOOINE – ANCHORHEAD SETTLEMENT – POWER | Jedi training, heroic journey",Neutral,Statement,Conversational,1992,EXT. TATOOINE – ANCHORHEAD SETTLEMENT – POWER,Star Wars A New Hope,13,neutral
LEIA,Princess Leia,Ben Kenobi is here! Where is he?,"Exterior: TATOOINE – ANCHORHEAD SETTLEMENT – POWER | Rebel leadership, royal dignity",Urgent/Commanding,Exclamation,Assertive,1994,EXT. TATOOINE – ANCHORHEAD SETTLEMENT – POWER,Star Wars A New Hope,7,neutral
LUKE,Luke Skywalker,Come on! INT. DEATH STAR – CONFERENCE ROOM,"Exterior: TATOOINE – ANCHORHEAD SETTLEMENT – POWER | Jedi training, heroic journey",Urgent/Commanding,Exclamation,Assertive,1995,EXT. TATOOINE – ANCHORHEAD SETTLEMENT – POWER,Star Wars A New Hope,8,neutral
VADER,Darth Vader,He is here…,"Exterior: TATOOINE – ANCHORHEAD SETTLEMENT – POWER | Dark Side presence, Imperial authority",Neutral,Statement,Conversational,1998,EXT. TATOOINE – ANCHORHEAD SETTLEMENT – POWER,Star Wars A New Hope,3,neutral
TARKIN,Grand Moff Tarkin,Obi-Wan Kenobi! What makes you think so?,Exterior: TATOOINE – ANCHORHEAD SETTLEMENT – POWER,Urgent/Commanding,Exclamation,Assertive,1999,EXT. TATOOINE – ANCHORHEAD SETTLEMENT – POWER,Star Wars A New Hope,7,neutral
VADER,Darth Vader,A tremor in the Force. The last time I felt it was in the,"Exterior: TATOOINE – ANCHORHEAD SETTLEMENT – POWER | Dark Side presence, Imperial authority",Neutral,Statement,Conversational,2000,EXT. TATOOINE – ANCHORHEAD SETTLEMENT – POWER,Star Wars A New Hope,14,neutral
TARKIN,Grand Moff Tarkin,Surely he must be dead by now.,Exterior: TATOOINE – ANCHORHEAD SETTLEMENT – POWER,Resistant/Negative,Statement,Opposing,2002,EXT. TATOOINE – ANCHORHEAD SETTLEMENT – POWER,Star Wars A New Hope,7,negative
VADER,Darth Vader,Don’t underestimate the Force.,"Exterior: TATOOINE – ANCHORHEAD SETTLEMENT – POWER | Dark Side presence, Imperial authority",Neutral,Statement,Conversational,2003,EXT. TATOOINE – ANCHORHEAD SETTLEMENT – POWER,Star Wars A New Hope,4,neutral
TARKIN,Grand Moff Tarkin,"The Jedi are extinct, their fire has gone out of the",Exterior: TATOOINE – ANCHORHEAD SETTLEMENT – POWER,Neutral,Statement,Conversational,2004,EXT. TATOOINE – ANCHORHEAD SETTLEMENT – POWER,Star Wars A New Hope,11,neutral
INTERCOM,Intercom,"VOICE Governor Tarkin, we have an emergency alert in",Exterior: TATOOINE – ANCHORHEAD SETTLEMENT – POWER,Resistant/Negative,Statement,Opposing,2008,EXT. TATOOINE – ANCHORHEAD SETTLEMENT – POWER,Star Wars A New Hope,9,negative
TARKIN,Grand Moff Tarkin,The princess! Put all sections on alert!,Exterior: TATOOINE – ANCHORHEAD SETTLEMENT – POWER,Urgent/Commanding,Exclamation,Assertive,2010,EXT. TATOOINE – ANCHORHEAD SETTLEMENT – POWER,Star Wars A New Hope,7,neutral
VADER,Darth Vader,Obi-Wan is here. The Force is with him.,"Exterior: TATOOINE – ANCHORHEAD SETTLEMENT – POWER | Dark Side presence, Imperial authority",Neutral,Statement,Conversational,2011,EXT. TATOOINE – ANCHORHEAD SETTLEMENT – POWER,Star Wars A New Hope,8,neutral
TARKIN,Grand Moff Tarkin,"If you’re right, he must not be allowed to escape.",Exterior: TATOOINE – ANCHORHEAD SETTLEMENT – POWER,Resistant/Negative,Statement,Opposing,2012,EXT. TATOOINE – ANCHORHEAD SETTLEMENT – POWER,Star Wars A New Hope,10,negative
VADER,Darth Vader,Escape may not his plan. I must face him alone. INT. DEATH,"Exterior: TATOOINE – ANCHORHEAD SETTLEMENT – POWER | Dark Side presence, Imperial authority",Resistant/Negative,Statement,Opposing,2013,EXT. TATOOINE – ANCHORHEAD SETTLEMENT – POWER,Star Wars A New Hope,12,negative
STAR,Star,– DETENTION AREA – HALLWAY,Exterior: TATOOINE – ANCHORHEAD SETTLEMENT – POWER,Urgent/Commanding,Exclamation,Assertive,2014,EXT. TATOOINE – ANCHORHEAD SETTLEMENT – POWER,Star Wars A New Hope,5,neutral
HAN,Han Solo,Chewie!,"Exterior: TATOOINE – ANCHORHEAD SETTLEMENT – POWER | Smuggler confidence, roguish charm",Urgent/Commanding,Exclamation,Assertive,2017,EXT. TATOOINE – ANCHORHEAD SETTLEMENT – POWER,Star Wars A New Hope,1,neutral
HAN,Han Solo,Get behind me! Get behind me!,"Exterior: TATOOINE – ANCHORHEAD SETTLEMENT – POWER | Smuggler confidence, roguish charm",Urgent/Commanding,Exclamation,Assertive,2019,EXT. TATOOINE – ANCHORHEAD SETTLEMENT – POWER,Star Wars A New Hope,6,neutral
HAN,Han Solo,Can’t get out that way.,"Exterior: TATOOINE – ANCHORHEAD SETTLEMENT – POWER | Smuggler confidence, roguish charm",Neutral,Statement,Conversational,2025,EXT. TATOOINE – ANCHORHEAD SETTLEMENT – POWER,Star Wars A New Hope,5,neutral
LEIA,Princess Leia,Looks like you managed to cut off our only escape route.,"Exterior: TATOOINE – ANCHORHEAD SETTLEMENT – POWER | Rebel leadership, royal dignity",Neutral,Statement,Conversational,2026,EXT. TATOOINE – ANCHORHEAD SETTLEMENT – POWER,Star Wars A New Hope,11,neutral
HAN,Han Solo,"(sarcastically) Maybe you’d like it back in your cell, Your","Exterior: TATOOINE – ANCHORHEAD SETTLEMENT – POWER | Smuggler confidence, roguish charm",Neutral,Statement,Conversational,2027,EXT. TATOOINE – ANCHORHEAD SETTLEMENT – POWER,Star Wars A New Hope,10,neutral
LUKE,Luke Skywalker,See-Threepio! See-Threepio!,"Exterior: TATOOINE – ANCHORHEAD SETTLEMENT – POWER | Jedi training, heroic journey",Urgent/Commanding,Exclamation,Assertive,2032,EXT. TATOOINE – ANCHORHEAD SETTLEMENT – POWER,Star Wars A New Hope,2,neutral
THREEPIO,C-3PO,(over comlink) Yes sir?,"Exterior: TATOOINE – ANCHORHEAD SETTLEMENT – POWER | Protocol droid formality, worry",Inquisitive,Question,Seeking information,2033,EXT. TATOOINE – ANCHORHEAD SETTLEMENT – POWER,Star Wars A New Hope,4,neutral
LUKE,Luke Skywalker,We’ve been cut off! Are there any other ways out of the cell,"Exterior: TATOOINE – ANCHORHEAD SETTLEMENT – POWER | Jedi training, heroic journey",Urgent/Commanding,Exclamation,Assertive,2034,EXT. TATOOINE – ANCHORHEAD SETTLEMENT – POWER,Star Wars A New Hope,13,neutral
BAY,Bay,GANTRY – CONTROL TOWER,Exterior: TATOOINE – ANCHORHEAD SETTLEMENT – POWER,Urgent/Commanding,Exclamation,Assertive,2036,EXT. TATOOINE – ANCHORHEAD SETTLEMENT – POWER,Star Wars A New Hope,4,neutral
THREEPIO,C-3PO,"I said, all systems have been alerted to your presence,","Exterior: TATOOINE – ANCHORHEAD SETTLEMENT – POWER | Protocol droid formality, worry",Neutral,Statement,Conversational,2039,EXT. TATOOINE – ANCHORHEAD SETTLEMENT – POWER,Star Wars A New Hope,10,neutral
TROOPER,Trooper,VOICE Open up in there!,Exterior: TATOOINE – ANCHORHEAD SETTLEMENT – POWER,Urgent/Commanding,Exclamation,Assertive,2043,EXT. TATOOINE – ANCHORHEAD SETTLEMENT – POWER,Star Wars A New Hope,5,neutral
THREEPIO,C-3PO,"Oh, no! INT. DEATH STAR – DETENTION CORRIDOR","Exterior: TATOOINE – ANCHORHEAD SETTLEMENT – POWER | Protocol droid formality, worry",Urgent/Commanding,Exclamation,Assertive,2044,EXT. TATOOINE – ANCHORHEAD SETTLEMENT – POWER,Star Wars A New Hope,8,neutral
LUKE,Luke Skywalker,There isn’t any other way out.,"Exterior: TATOOINE – ANCHORHEAD SETTLEMENT – POWER | Jedi training, heroic journey",Neutral,Statement,Conversational,2049,EXT. TATOOINE – ANCHORHEAD SETTLEMENT – POWER,Star Wars A New Hope,6,neutral
HAN,Han Solo,I can’t hold them off forever! Now what?,"Exterior: TATOOINE – ANCHORHEAD SETTLEMENT – POWER | Smuggler confidence, roguish charm",Urgent/Commanding,Exclamation,Assertive,2050,EXT. TATOOINE – ANCHORHEAD SETTLEMENT – POWER,Star Wars A New Hope,8,neutral
LEIA,Princess Leia,"This is some rescue. When you came in here, didn’t you have","Exterior: TATOOINE – ANCHORHEAD SETTLEMENT – POWER | Rebel leadership, royal dignity",Neutral,Statement,Conversational,2051,EXT. TATOOINE – ANCHORHEAD SETTLEMENT – POWER,Star Wars A New Hope,12,neutral
HAN,Han Solo,"(pointing to Luke) He’s the brains, sweetheart.","Exterior: TATOOINE – ANCHORHEAD SETTLEMENT – POWER | Smuggler confidence, roguish charm",Neutral,Statement,Conversational,2053,EXT. TATOOINE – ANCHORHEAD SETTLEMENT – POWER,Star Wars A New Hope,7,neutral
LUKE,Luke Skywalker,"Well, I didn’t…","Exterior: TATOOINE – ANCHORHEAD SETTLEMENT – POWER | Jedi training, heroic journey",Neutral,Statement,Conversational,2055,EXT. TATOOINE – ANCHORHEAD SETTLEMENT – POWER,Star Wars A New Hope,3,neutral
HAN,Han Solo,What the hell are you doing?,"Exterior: TATOOINE – ANCHORHEAD SETTLEMENT – POWER | Smuggler confidence, roguish charm",Inquisitive,Question,Seeking information,2058,EXT. TATOOINE – ANCHORHEAD SETTLEMENT – POWER,Star Wars A New Hope,6,neutral
LEIA,Princess Leia,"Somebody has to save our skins. Into the garbage chute, wise","Exterior: TATOOINE – ANCHORHEAD SETTLEMENT – POWER | Rebel leadership, royal dignity",Neutral,Statement,Conversational,2059,EXT. TATOOINE – ANCHORHEAD SETTLEMENT – POWER,Star Wars A New Hope,11,neutral
HAN,Han Solo,Get in there you big furry oaf! I don’t care what you smell! Get in,"Exterior: TATOOINE – ANCHORHEAD SETTLEMENT – POWER | Smuggler confidence, roguish charm",Urgent/Commanding,Exclamation,Assertive,2064,EXT. TATOOINE – ANCHORHEAD SETTLEMENT – POWER,Star Wars A New Hope,15,neutral
HAN,Han Solo,Wonderful girl! Either I’m going to kill her or I’m beginning to like,"Exterior: TATOOINE – ANCHORHEAD SETTLEMENT – POWER | Smuggler confidence, roguish charm",Urgent/Commanding,Exclamation,Assertive,2069,EXT. TATOOINE – ANCHORHEAD SETTLEMENT – POWER,Star Wars A New Hope,13,neutral
HAN,Han Solo,(sarcastically) Oh! The garbage chute was a really wonderful,"Exterior: TATOOINE – ANCHORHEAD SETTLEMENT – POWER | Smuggler confidence, roguish charm",Urgent/Commanding,Exclamation,Assertive,2077,EXT. TATOOINE – ANCHORHEAD SETTLEMENT – POWER,Star Wars A New Hope,9,neutral
LUKE,Luke Skywalker,No! wait!,"Exterior: TATOOINE – ANCHORHEAD SETTLEMENT – POWER | Jedi training, heroic journey",Urgent/Commanding,Exclamation,Assertive,2080,EXT. TATOOINE – ANCHORHEAD SETTLEMENT – POWER,Star Wars A New Hope,2,neutral
LUKE,Luke Skywalker,Will you forget it? I already tried it. It’s magnetically sealed!,"Exterior: TATOOINE – ANCHORHEAD SETTLEMENT – POWER | Jedi training, heroic journey",Urgent/Commanding,Exclamation,Assertive,2085,EXT. TATOOINE – ANCHORHEAD SETTLEMENT – POWER,Star Wars A New Hope,11,neutral
LEIA,Princess Leia,Put that thing away! You’re going to get us all killed.,"Exterior: TATOOINE – ANCHORHEAD SETTLEMENT – POWER | Rebel leadership, royal dignity",Urgent/Commanding,Exclamation,Assertive,2086,EXT. TATOOINE – ANCHORHEAD SETTLEMENT – POWER,Star Wars A New Hope,11,neutral
HAN,Han Solo,"Absolutely, Your Worship. Look, I had everything under","Exterior: TATOOINE – ANCHORHEAD SETTLEMENT – POWER | Smuggler confidence, roguish charm",Neutral,Statement,Conversational,2087,EXT. TATOOINE – ANCHORHEAD SETTLEMENT – POWER,Star Wars A New Hope,8,neutral
LEIA,Princess Leia,It could be worse…,"Exterior: TATOOINE – ANCHORHEAD SETTLEMENT – POWER | Rebel leadership, royal dignity",Neutral,Statement,Conversational,2090,EXT. TATOOINE – ANCHORHEAD SETTLEMENT – POWER,Star Wars A New Hope,4,neutral
HAN,Han Solo,It’s worse.,"Exterior: TATOOINE – ANCHORHEAD SETTLEMENT – POWER | Smuggler confidence, roguish charm",Neutral,Statement,Conversational,2095,EXT. TATOOINE – ANCHORHEAD SETTLEMENT – POWER,Star Wars A New Hope,2,neutral
LUKE,Luke Skywalker,There’s something alive in here!,"Exterior: TATOOINE – ANCHORHEAD SETTLEMENT – POWER | Jedi training, heroic journey",Urgent/Commanding,Exclamation,Assertive,2096,EXT. TATOOINE – ANCHORHEAD SETTLEMENT – POWER,Star Wars A New Hope,5,neutral
HAN,Han Solo,That’s your imagination.,"Exterior: TATOOINE – ANCHORHEAD SETTLEMENT – POWER | Smuggler confidence, roguish charm",Neutral,Statement,Conversational,2097,EXT. TATOOINE – ANCHORHEAD SETTLEMENT – POWER,Star Wars A New Hope,3,neutral
LUKE,Luke Skywalker,Something just moves past my leg! Look! Did you see that?,"Exterior: TATOOINE – ANCHORHEAD SETTLEMENT – POWER | Jedi training, heroic journey",Urgent/Commanding,Exclamation,Assertive,2098,EXT. TATOOINE – ANCHORHEAD SETTLEMENT – POWER,Star Wars A New Hope,11,neutral
HAN,Han Solo,What?,"Exterior: TATOOINE – ANCHORHEAD SETTLEMENT – POWER | Smuggler confidence, roguish charm",Inquisitive,Question,Seeking information,2099,EXT. TATOOINE – ANCHORHEAD SETTLEMENT – POWER,Star Wars A New Hope,1,neutral
LUKE,Luke Skywalker,Help!,"Exterior: TATOOINE – ANCHORHEAD SETTLEMENT – POWER | Jedi training, heroic journey",Urgent/Commanding,Exclamation,Assertive,2100,EXT. TATOOINE – ANCHORHEAD SETTLEMENT – POWER,Star Wars A New Hope,1,neutral
HAN,Han Solo,Luke! Luke! Luke!,"Exterior: TATOOINE – ANCHORHEAD SETTLEMENT – POWER | Smuggler confidence, roguish charm",Urgent/Commanding,Exclamation,Assertive,2102,EXT. TATOOINE – ANCHORHEAD SETTLEMENT – POWER,Star Wars A New Hope,3,neutral
LEIA,Princess Leia,Luke!,"Exterior: TATOOINE – ANCHORHEAD SETTLEMENT – POWER | Rebel leadership, royal dignity",Urgent/Commanding,Exclamation,Assertive,2106,EXT. TATOOINE – ANCHORHEAD SETTLEMENT – POWER,Star Wars A New Hope,1,neutral
LEIA,Princess Leia,"Luke, Luke, grab a hold of this.","Exterior: TATOOINE – ANCHORHEAD SETTLEMENT – POWER | Rebel leadership, royal dignity",Neutral,Statement,Conversational,2108,EXT. TATOOINE – ANCHORHEAD SETTLEMENT – POWER,Star Wars A New Hope,7,neutral
LUKE,Luke Skywalker,"Blast it, will you! My gun’s jammed.","Exterior: TATOOINE – ANCHORHEAD SETTLEMENT – POWER | Jedi training, heroic journey",Urgent/Commanding,Exclamation,Assertive,2109,EXT. TATOOINE – ANCHORHEAD SETTLEMENT – POWER,Star Wars A New Hope,7,neutral
HAN,Han Solo,Where?,"Exterior: TATOOINE – ANCHORHEAD SETTLEMENT – POWER | Smuggler confidence, roguish charm",Inquisitive,Question,Seeking information,2110,EXT. TATOOINE – ANCHORHEAD SETTLEMENT – POWER,Star Wars A New Hope,1,neutral
LUKE,Luke Skywalker,Anywhere! Oh!!,"Exterior: TATOOINE – ANCHORHEAD SETTLEMENT – POWER | Jedi training, heroic journey",Urgent/Commanding,Exclamation,Assertive,2111,EXT. TATOOINE – ANCHORHEAD SETTLEMENT – POWER,Star Wars A New Hope,2,neutral
HAN,Han Solo,Luke! Luke!,"Exterior: TATOOINE – ANCHORHEAD SETTLEMENT – POWER | Smuggler confidence, roguish charm",Urgent/Commanding,Exclamation,Assertive,2114,EXT. TATOOINE – ANCHORHEAD SETTLEMENT – POWER,Star Wars A New Hope,2,neutral
LEIA,Princess Leia,Grab him!,"Exterior: TATOOINE – ANCHORHEAD SETTLEMENT – POWER | Rebel leadership, royal dignity",Urgent/Commanding,Exclamation,Assertive,2119,EXT. TATOOINE – ANCHORHEAD SETTLEMENT – POWER,Star Wars A New Hope,2,neutral
LEIA,Princess Leia,What happened?,"Exterior: TATOOINE – ANCHORHEAD SETTLEMENT – POWER | Rebel leadership, royal dignity",Inquisitive,Question,Seeking information,2121,EXT. TATOOINE – ANCHORHEAD SETTLEMENT – POWER,Star Wars A New Hope,2,neutral
LUKE,Luke Skywalker,"I don’t know, it just let go of me and disappeared…","Exterior: TATOOINE – ANCHORHEAD SETTLEMENT – POWER | Jedi training, heroic journey",Resistant/Negative,Statement,Opposing,2122,EXT. TATOOINE – ANCHORHEAD SETTLEMENT – POWER,Star Wars A New Hope,11,negative
HAN,Han Solo,I’ve got a very bad feeling about this.,"Exterior: TATOOINE – ANCHORHEAD SETTLEMENT – POWER | Smuggler confidence, roguish charm",Neutral,Statement,Conversational,2123,EXT. TATOOINE – ANCHORHEAD SETTLEMENT – POWER,Star Wars A New Hope,8,neutral
LUKE,Luke Skywalker,The walls are moving!,"Exterior: TATOOINE – ANCHORHEAD SETTLEMENT – POWER | Jedi training, heroic journey",Urgent/Commanding,Exclamation,Assertive,2126,EXT. TATOOINE – ANCHORHEAD SETTLEMENT – POWER,Star Wars A New Hope,4,neutral
